{
  "rank": 13,
  "slug": "13-final-parsec",
  "title": "The final-parsec problem",
  "aliases": ["last parsec problem", "SMBH binary stalling", "final-parsec problem"],
  "statement": "When two galaxies merge, their central supermassive black holes sink toward the center and form a binary. Dynamical friction and stellar scattering harden the binary efficiently down to roughly parsec separation, but there the binary may run out of stars on intersecting (loss-cone) orbits to extract its angular momentum, while gravitational-wave emission is still far too weak to drive a merger. The binary could then stall for longer than a Hubble time. Whether (and how) SMBH binaries cross this 'final parsec' to merge is open — and directly relevant to the nanohertz gravitational-wave background now detected by pulsar-timing arrays.",
  "first_posed": "1980",
  "originators": [
    {"name": "Mitchell Begelman"}, {"name": "Roger Blandford"}, {"name": "Martin Rees", "note": "1980 Nature paper describing the binary-SMBH evolution and the stalling problem."}
  ],
  "status": "open-with-recent-progress",
  "statement_tier": "numerical_approximation",
  "resolution_tier": "open_conjecture",
  "ranking": {
    "depth": 3,
    "age": 6,
    "tractability": 7,
    "rationale": "A Newtonian/astrophysical dynamics problem (shallow in the fundamental sense) with active N-body/hydrodynamic simulations and a new observational handle (PTA nanohertz background); likely resolvable, so it sits near the bottom."
  },
  "key_ideas": [
    "Stages: dynamical friction (kpc) -> three-body stellar scattering (parsec) -> gravitational-wave inspiral (milliparsec). The gap is between the second and third.",
    "Loss-cone depletion: stars on orbits that interact with the binary are ejected faster than they are replenished, stalling the hardening.",
    "Proposed solutions: non-spherical (triaxial) or rotating nuclei keep the loss cone full; gas-disk torques; or a third black hole inducing Kozai-Lidov oscillations.",
    "The detected PTA nanohertz GW background is consistent with a cosmic population of merging SMBH binaries, evidence that the final parsec IS crossed in many systems.",
    "Sets the event rate for future space-based (LISA) and PTA gravitational-wave observations.",
    "Connects to SMBH seeds (#12) and galaxy-merger demographics."
  ],
  "approaches": [
    {"name": "Triaxial / rotating-nucleus N-body", "summary": "Non-spherical galaxy potentials keep the loss cone refilled, avoiding stalling.", "tier": "numerical_approximation", "proponents": ["David Merritt", "Fazeel Khan", "Peter Berczik"]},
    {"name": "Gas-driven inspiral", "summary": "Circumbinary gas disks torque the binary across the gap.", "tier": "numerical_approximation", "proponents": ["(community)"]},
    {"name": "PTA observational test", "summary": "Use the nanohertz GW background spectrum to infer whether/how binaries merge.", "tier": "observational_constraint", "proponents": ["NANOGrav", "EPTA", "PPTA", "IPTA"]}
  ],
  "papers": [
    {"title": "Massive black hole binaries in active galactic nuclei", "authors": ["Mitchell C. Begelman", "Roger D. Blandford", "Martin J. Rees"], "year": 1980, "kind": "foundational", "tier": "numerical_approximation", "note": "Nature 287, 307 — defines the binary-SMBH evolution and stalling."},
    {"title": "The Final Parsec Problem", "authors": ["Milos Milosavljevic", "David Merritt"], "year": 2003, "kind": "foundational", "tier": "numerical_approximation", "identifier": {"arxiv": "astro-ph/0212270"}},
    {"title": "Efficient Merger of Binary Supermassive Black Holes in Non-axisymmetric Galaxies", "authors": ["Fazeel Mahmood Khan", "Andreas Just", "David Merritt"], "year": 2011, "kind": "recent", "tier": "numerical_approximation", "identifier": {"arxiv": "1103.0272"}},
    {"title": "The NANOGrav 15 yr Data Set: Evidence for a Gravitational-wave Background", "authors": ["NANOGrav Collaboration"], "year": 2023, "kind": "recent", "tier": "observational_constraint", "identifier": {"arxiv": "2306.16213"}}
  ],
  "physicists": [
    {"name": "Martin Rees", "role": "originator", "era": "1980-present", "affiliation": "Cambridge", "contribution": "Co-author of the founding binary-SMBH paper."},
    {"name": "Roger Blandford", "role": "originator", "era": "1980-present", "affiliation": "Stanford", "contribution": "Co-author; AGN/jet theory."},
    {"name": "Mitchell Begelman", "role": "originator", "era": "1980-present", "affiliation": "Colorado", "contribution": "Co-author of the 1980 framework."},
    {"name": "David Merritt", "role": "active", "era": "1990s-present", "affiliation": "RIT (emeritus)", "contribution": "Named/analyzed the final-parsec problem; loss-cone dynamics."},
    {"name": "Fazeel Khan", "role": "active", "era": "2010s-present", "affiliation": "Pakistan/IST", "contribution": "Showed triaxial galaxies avoid stalling in N-body simulations."}
  ],
  "related_problems": [12],
  "simulator_angle": "Outside the single-black-hole GR ray tracer; but a future binary/merger visualization and the resulting ringdown (a no-hair test, #11) connect back to it.",
  "metadata": {"created": "2026-06-14", "updated": "2026-06-14", "coverage_note": "Seed: 4 key references (Milosavljevic-Merritt/Khan/NANOGrav with arXiv ids; Begelman-Blandford-Rees 1980 as note) + 5 physicists. Aspiration up to 25 papers, to be expanded.", "confidence": "seed"}
}
