{
  "rank": 8,
  "slug": "08-er-epr",
  "title": "ER=EPR and the entanglement-geometry connection",
  "aliases": ["ER=EPR", "entanglement is geometry", "spacetime from entanglement"],
  "statement": "Maldacena and Susskind (2013) conjectured ER=EPR: that an Einstein-Rosen bridge (ER, a wormhole) is dual to quantum entanglement (EPR), so two entangled systems are connected by a (generally non-traversable) geometric bridge. More broadly, the conjecture suggests spacetime connectivity itself emerges from entanglement (Van Raamsdonk; Ryu-Takayanagi). A precise, general, and proven formulation — specifying exactly which entangled states correspond to which geometries, and in what regime — remains open.",
  "first_posed": "2013",
  "originators": [
    {"name": "Juan Maldacena"}, {"name": "Leonard Susskind"}
  ],
  "status": "open",
  "statement_tier": "open_conjecture",
  "resolution_tier": "open_conjecture",
  "ranking": {
    "depth": 8,
    "age": 4,
    "tractability": 5,
    "rationale": "Among the most generative recent ideas (it ties together holography, the information paradox and emergent spacetime), but it is a conjecture, not a theorem; ranked mid-list as deep-but-actively-developing."
  },
  "key_ideas": [
    "An eternal AdS black hole is dual to two CFTs in the thermofield-double (maximally entangled) state, connected by a non-traversable wormhole (Maldacena 2001).",
    "ER=EPR generalizes this: entanglement between any two systems is geometric connectivity.",
    "Van Raamsdonk: disentangling boundary regions pinches off the bulk, so entanglement 'builds' spacetime.",
    "Ryu-Takayanagi: entanglement entropy equals the area of a bulk minimal surface — area/entanglement again.",
    "Traversable wormholes (Gao-Jafferis-Wall) realize controlled information transfer, sharpening ER=EPR.",
    "Bears on the firewall (#06): identifying interior and exterior partners as the same wormhole endpoints can preserve a smooth horizon."
  ],
  "approaches": [
    {"name": "Holographic entanglement (Ryu-Takayanagi / QES)", "summary": "Geometrize entanglement entropy as minimal-surface area; quantum extremal surfaces extend it.", "tier": "open_conjecture", "proponents": ["Shinsei Ryu", "Tadashi Takayanagi", "Netta Engelhardt"]},
    {"name": "Emergent spacetime from entanglement", "summary": "Reconstruct bulk geometry/connectivity from boundary entanglement structure.", "tier": "open_conjecture", "proponents": ["Mark Van Raamsdonk", "Brian Swingle"]},
    {"name": "Traversable wormholes", "summary": "Engineer entanglement (a double-trace coupling) to make the bridge traversable, testing ER=EPR operationally.", "tier": "open_conjecture", "proponents": ["Ping Gao", "Daniel Jafferis", "Aron Wall"]}
  ],
  "papers": [
    {"title": "The Large N Limit of Superconformal Field Theories and Supergravity (AdS/CFT)", "authors": ["Juan Maldacena"], "year": 1998, "kind": "foundational", "tier": "open_conjecture", "identifier": {"arxiv": "hep-th/9711200"}, "note": "the holographic duality underpinning ER=EPR."},
    {"title": "Cool horizons for entangled black holes (ER=EPR)", "authors": ["Juan Maldacena", "Leonard Susskind"], "year": 2013, "kind": "foundational", "tier": "open_conjecture", "identifier": {"arxiv": "1306.0533"}},
    {"title": "Building up spacetime with quantum entanglement", "authors": ["Mark Van Raamsdonk"], "year": 2010, "kind": "foundational", "tier": "open_conjecture", "identifier": {"arxiv": "1005.3035"}},
    {"title": "Holographic Derivation of Entanglement Entropy from AdS/CFT (Ryu-Takayanagi)", "authors": ["Shinsei Ryu", "Tadashi Takayanagi"], "year": 2006, "kind": "foundational", "tier": "open_conjecture", "identifier": {"arxiv": "hep-th/0603001"}},
    {"title": "Traversable Wormholes via a Double Trace Deformation", "authors": ["Ping Gao", "Daniel L. Jafferis", "Aron C. Wall"], "year": 2017, "kind": "recent", "tier": "open_conjecture", "identifier": {"arxiv": "1608.05687"}}
  ],
  "physicists": [
    {"name": "Juan Maldacena", "role": "originator", "era": "1997-present", "affiliation": "IAS Princeton", "contribution": "AdS/CFT; ER=EPR; eternal-black-hole/thermofield-double duality."},
    {"name": "Leonard Susskind", "role": "originator", "era": "2013-present", "affiliation": "Stanford", "contribution": "ER=EPR; complexity=volume/action."},
    {"name": "Mark Van Raamsdonk", "role": "active", "era": "2010-present", "affiliation": "UBC", "contribution": "Spacetime emergent from entanglement."},
    {"name": "Tadashi Takayanagi", "role": "active", "era": "2006-present", "affiliation": "Kyoto (YITP)", "contribution": "Ryu-Takayanagi holographic entanglement entropy."},
    {"name": "Shinsei Ryu", "role": "active", "era": "2006-present", "affiliation": "Princeton", "contribution": "Holographic entanglement entropy formula."},
    {"name": "Daniel Jafferis", "role": "active", "era": "2010s-present", "affiliation": "Harvard", "contribution": "Traversable wormholes; bulk reconstruction."},
    {"name": "Brian Swingle", "role": "active", "era": "2010s-present", "affiliation": "Brandeis", "contribution": "Tensor-network / emergent-geometry picture."}
  ],
  "related_problems": [2, 6, 3, 7],
  "simulator_angle": "The eternal-black-hole (maximally-extended Kerr/Schwarzschild) geometry with its Einstein-Rosen bridge is a renderable spacetime; the simulator's metric machinery could visualize the two-sided geometry, while the entanglement duality is conceptual.",
  "metadata": {"created": "2026-06-14", "updated": "2026-06-14", "coverage_note": "Seed: 5 key references with arXiv ids + 7 physicists. Aspiration up to 25 papers, to be expanded.", "confidence": "seed"}
}
